{
  "$schema": "http://localhost:3020/r/schema/components.json",
  "system": "chakra",
  "style": "default",
  "rsc": true,
  "tsx": true,
  "installed": [
    "accordion",
    "action-bar",
    "alert",
    "app-shell",
    "aside",
    "avatar",
    "blockquote",
    "breadcrumb",
    "checkbox",
    "checkbox-card",
    "clipboard",
    "close-button",
    "color-mode",
    "data-table",
    "dialog",
    "drawer",
    "empty-state",
    "file-upload",
    "format-date",
    "forms",
    "grid-list",
    "hover-card",
    "icon-button",
    "info-tip",
    "link",
    "menu",
    "modals",
    "native-select",
    "navbar",
    "number-input",
    "page",
    "pagination",
    "password-input",
    "persona",
    "pin-input",
    "popover",
    "radio",
    "radio-card",
    "search-input",
    "segmented-control",
    "select",
    "sidebar",
    "skeleton",
    "slider",
    "spinner",
    "split-page",
    "stat",
    "status",
    "steps",
    "switch",
    "tag",
    "theme",
    "toaster",
    "toggle-tip",
    "tooltip"
  ],
  "aliases": {
    "components": "compositions/components",
    "utils": "compositions/lib/utils",
    "ui": "compositions/ui",
    "lib": "compositions/lib",
    "hooks": "compositions/hooks",
    "icons": "compositions/icons"
  }
}
